{
  "id": "synthetic-valid-from-day-of",
  "description": "Synthetic smoke test: a stay on valid_from matches the rule",
  "rule_set_path": "../2026-01-01.json",
  "booking_input": {
    "stay_date": "2026-01-01",
    "nights": 1,
    "adults": 1,
    "children": 0,
    "property_municipality_code": "0363",
    "accommodation_type": "camping",
    "subtotal": 0.0
  },
  "expected": {
    "total_tax": 2.5,
    "matched_rule_ids": ["synthetic-camping-demo-2026"]
  }
}
