{
  "id": "nl-amsterdam-percentage-of-base-rounding-up",
  "description": "Amsterdam 2026: 7% tourist tax rounds to EUR 7.01 when the raw amount is EUR 7.0056",
  "rule_set_path": "../2026-01-01.json",
  "booking_input": {
    "stay_date": "2026-06-01",
    "nights": 1,
    "adults": 1,
    "children": 0,
    "property_municipality_code": "0363",
    "accommodation_type": "hotel",
    "subtotal": 100.08
  },
  "expected": {
    "total_tax": 7.01,
    "matched_rule_ids": ["nl-amsterdam-2026-general"]
  }
}
