{
  "id": "synthetic-valid-from-day-before",
  "description": "Synthetic smoke test: a stay before valid_from does not match the rule",
  "rule_set_path": "../2026-01-01.json",
  "booking_input": {
    "stay_date": "2025-12-31",
    "nights": 1,
    "adults": 1,
    "children": 0,
    "property_municipality_code": "0363",
    "accommodation_type": "camping",
    "subtotal": 0.0
  },
  "expected": {
    "total_tax": 0.0,
    "matched_rule_ids": []
  }
}
