{
  "id": "es-catalonia-demo-dutch-operator-barcelona-hotel",
  "description": "A Dutch operator with a Barcelona hotel is taxed under the Spanish property location, not the operator's legal country.",
  "rule_set_path": "../2026-04-01.json",
  "booking_input": {
    "stay_date": "2026-06-15",
    "nights": 10,
    "adults": 2,
    "children": 1,
    "guests": [
      { "age": 34, "role": "guest" },
      { "age": 38, "role": "guest" },
      { "age": 15, "role": "guest" }
    ],
    "property_location": {
      "country_code": "ES",
      "region_code": "ES-CT",
      "locality_kind": "municipality",
      "locality_code": "08019",
      "locality_name": "Barcelona"
    },
    "operator": {
      "legal_country_code": "NL",
      "legal_name": "Canal Stays BV"
    },
    "accommodation_type": "hotel",
    "subtotal": 1500
  },
  "expected": {
    "total_tax": 49.0,
    "matched_rule_ids": ["es-ct-barcelona-2026-hotel"]
  }
}
