{
  "id": "nl-uithoorn-previous-ordinance-last-day",
  "description": "Uithoorn 2025: the previous ordinance still applies on its final valid day",
  "rule_set_path": "../2025-01-01.json",
  "booking_input": {
    "stay_date": "2025-12-31",
    "nights": 1,
    "adults": 1,
    "children": 0,
    "property_municipality_code": "0451",
    "accommodation_type": "hotel",
    "subtotal": 0.0
  },
  "expected": {
    "total_tax": 3.37,
    "matched_rule_ids": ["2025-01-01-rate-1"]
  }
}
