{
  "id": "es-catalonia-rest-girona-hotel-4-star",
  "description": "A Girona 4-star hotel outside Barcelona city uses the rest-of-Catalonia IEET tariff.",
  "rule_set_path": "../2026-04-01.json",
  "booking_input": {
    "stay_date": "2026-07-20",
    "nights": 2,
    "adults": 2,
    "children": 0,
    "guests": [
      { "age": 42, "role": "guest" },
      { "age": 36, "role": "guest" }
    ],
    "property_location": {
      "country_code": "ES",
      "region_code": "ES-CT",
      "locality_kind": "municipality",
      "locality_code": "17079",
      "locality_name": "Girona"
    },
    "accommodation_type": "hotel_4_star",
    "subtotal": 500
  },
  "expected": {
    "total_tax": 7.2,
    "matched_rule_ids": ["es-ct-rest-2026-hotel-4-star"]
  }
}
