{
  "id": "nl-amsterdam-percentage-of-base-normal",
  "description": "Amsterdam 2026: 7% tourist tax on a EUR 100.00 accommodation fee excluding tax yields EUR 7.00",
  "rule_set_path": "../2026-01-01.json",
  "booking_input": {
    "stay_date": "2026-06-01",
    "nights": 1,
    "adults": 1,
    "children": 0,
    "property_municipality_code": "0363",
    "accommodation_type": "hotel",
    "subtotal": 100.0
  },
  "expected": {
    "total_tax": 7.0,
    "matched_rule_ids": ["nl-amsterdam-2026-general"]
  }
}
